{
  "format": "drawio-rule-provider-result/v1",
  "request_sha256": "2ecb6aa51964973e1fd81622d2ea75469ae6fd284ac3cd23d69bcecb6ae7be8f",
  "provider": {
    "id": "organization-guardrails",
    "version": "1.0.0"
  },
  "results": [
    {
      "id": "event-stream-owner",
      "rule_id": "ownership.event-stream",
      "level": "warning",
      "passed": false,
      "message": "Confirm the event-stream ownership decision before the exception expires.",
      "page": "logical",
      "cell": "events"
    }
  ]
}
